{
  "artifacts": [
    "runs/native-r2-63fb9bfa/prompt.txt",
    "runs/native-r2-63fb9bfa/events.jsonl",
    "runs/native-r2-63fb9bfa/stderr.txt"
  ],
  "case_id": "tiny_python.repository_understanding.v1",
  "condition": "native",
  "contract_version": "0.1",
  "environment": {
    "clean_workspace": true,
    "history_access": false,
    "logiclens": null,
    "network_access": false,
    "prompt_wrapper": "Fresh snapshot; no network or repository history; identical user task and answer schema across conditions.",
    "repository_snapshot_id": "dcdad6f9ef1eb8581fffb1b66fb34f3b4f8bb3de8e60f1a04d51946d32c611cf"
  },
  "error": null,
  "harness": {
    "adapter_id": "codex-cli",
    "adapter_version": "0.1",
    "name": "Codex CLI",
    "version": "codex-cli 0.148.0"
  },
  "model": {
    "configuration": {},
    "name": "gpt-5.6-sol",
    "provider": "openai",
    "version": null
  },
  "output": {
    "raw_output_path": "runs/native-r2-63fb9bfa/answer.json",
    "schema": "evals/schemas/answer.schema.json",
    "value": {
      "case_id": "tiny_python.repository_understanding.v1",
      "contract_version": "0.1",
      "turns": [
        {
          "claims": [
            {
              "claim_id": "c1",
              "confidence": 1,
              "evidence": [
                {
                  "end_line": 5,
                  "kind": "source_span",
                  "path": "README.md",
                  "start_line": 1
                }
              ],
              "stance": "confirmed",
              "statement": "Tiny Shop is a minimal demonstration of a three-layer order-creation flow: main constructs a service, the service applies the use case, and an in-memory repository handles the order identifier."
            },
            {
              "claim_id": "c2",
              "confidence": 0.99,
              "evidence": [
                {
                  "end_line": 4,
                  "kind": "source_span",
                  "path": "pyproject.toml",
                  "start_line": 1
                },
                {
                  "end_line": 12,
                  "kind": "source_span",
                  "path": "src/shop/main.py",
                  "start_line": 1
                }
              ],
              "stance": "confirmed",
              "statement": "No executable, HTTP, or CLI entry point is declared in the repository; pyproject.toml contains only project metadata, and main.py defines callable functions without a runner block or server setup."
            },
            {
              "claim_id": "c3",
              "confidence": 0.98,
              "evidence": [
                {
                  "end_line": 5,
                  "kind": "source_span",
                  "path": "README.md",
                  "start_line": 3
                },
                {
                  "end_line": 12,
                  "kind": "source_span",
                  "path": "src/shop/main.py",
                  "start_line": 10
                }
              ],
              "stance": "inferred",
              "statement": "shop.main.create_order is the likely business-facing entry function because the README names it as the start of the flow and it accepts an order ID and returns the service result."
            },
            {
              "claim_id": "c4",
              "confidence": 1,
              "evidence": [
                {
                  "end_line": 7,
                  "kind": "source_span",
                  "path": "src/shop/main.py",
                  "start_line": 5
                }
              ],
              "stance": "confirmed",
              "statement": "build_service creates a new OrderRepository and injects it into a new OrderService."
            },
            {
              "claim_id": "c5",
              "confidence": 1,
              "evidence": [
                {
                  "end_line": 12,
                  "kind": "source_span",
                  "path": "src/shop/main.py",
                  "start_line": 10
                },
                {
                  "end_line": 9,
                  "kind": "source_span",
                  "path": "src/shop/service.py",
                  "start_line": 4
                }
              ],
              "stance": "confirmed",
              "statement": "Order creation calls create_order(order_id), constructs a service, and delegates to OrderService.create(order_id), which delegates to repository.save(order_id)."
            },
            {
              "claim_id": "c6",
              "confidence": 1,
              "evidence": [
                {
                  "end_line": 3,
                  "kind": "source_span",
                  "path": "src/shop/repository.py",
                  "start_line": 1
                }
              ],
              "stance": "confirmed",
              "statement": "OrderRepository.save simply returns the supplied order ID; it stores no observable state."
            },
            {
              "claim_id": "c7",
              "confidence": 0.96,
              "evidence": [
                {
                  "end_line": 5,
                  "kind": "source_span",
                  "path": "README.md",
                  "start_line": 3
                },
                {
                  "end_line": 3,
                  "kind": "source_span",
                  "path": "src/shop/repository.py",
                  "start_line": 1
                }
              ],
              "stance": "inferred",
              "statement": "The README's use of \u201cpersists\u201d is conceptual: the current repository implementation performs identity passthrough rather than durable or in-memory stateful persistence."
            }
          ],
          "reading_order": [
            "README.md",
            "pyproject.toml",
            "src/shop/main.py",
            "src/shop/service.py",
            "src/shop/repository.py",
            "src/shop/__init__.py"
          ],
          "relations": [
            {
              "confidence": 1,
              "evidence": [
                {
                  "end_line": 12,
                  "kind": "source_span",
                  "path": "src/shop/main.py",
                  "start_line": 10
                }
              ],
              "kind": "delegates_to",
              "relation_id": "r1",
              "source": "shop.main.create_order",
              "target": "OrderService.create"
            },
            {
              "confidence": 1,
              "evidence": [
                {
                  "end_line": 7,
                  "kind": "source_span",
                  "path": "src/shop/main.py",
                  "start_line": 5
                }
              ],
              "kind": "constructs",
              "relation_id": "r2",
              "source": "shop.main.build_service",
              "target": "OrderRepository"
            },
            {
              "confidence": 1,
              "evidence": [
                {
                  "end_line": 7,
                  "kind": "source_span",
                  "path": "src/shop/main.py",
                  "start_line": 5
                }
              ],
              "kind": "injects_into",
              "relation_id": "r3",
              "source": "OrderRepository",
              "target": "OrderService"
            },
            {
              "confidence": 1,
              "evidence": [
                {
                  "end_line": 9,
                  "kind": "source_span",
                  "path": "src/shop/service.py",
                  "start_line": 8
                }
              ],
              "kind": "delegates_to",
              "relation_id": "r4",
              "source": "OrderService.create",
              "target": "OrderRepository.save"
            },
            {
              "confidence": 1,
              "evidence": [
                {
                  "end_line": 3,
                  "kind": "source_span",
                  "path": "src/shop/repository.py",
                  "start_line": 1
                }
              ],
              "kind": "returns_unchanged",
              "relation_id": "r5",
              "source": "OrderRepository.save",
              "target": "order_id"
            }
          ],
          "summary": "Tiny Shop is a deliberately small layered Python example. Its likely business entry is create_order, but no executable, HTTP, or CLI entry point is configured. The call chain is create_order \u2192 build_service \u2192 OrderService.create \u2192 OrderRepository.save, ending with the unchanged order ID.",
          "turn_id": "onboarding",
          "unknowns": [
            "How callers invoke create_order in a deployed or executable environment is not specified.",
            "No tests or requirements describe validation, duplicate handling, failures, or real persistence semantics."
          ]
        }
      ]
    }
  },
  "repetition": 2,
  "run_id": "native-r2-63fb9bfa",
  "sequence_index": 3,
  "status": "completed",
  "timing": {
    "started_at": "2026-08-20T20:19:59.993452+00:00",
    "wall_ms": 34610
  },
  "track": "controlled_model",
  "usage": {
    "cost_usd": null,
    "input_tokens": 47232,
    "output_tokens": 1524,
    "raw_files_read": null,
    "tool_calls": 2
  }
}
